name,industry,category,country,city,address,website,phone,email,description,logoUrl,products,certifications,moq,rating,reviewCount,sourceUrl
Rhein Steel Werke GmbH,Metal,Steel & Metals,Germany,Duisburg,"Hafenstrasse 12, 47119 Duisburg",https://example-rheinsteel.com,+49 203 555 0101,sales@example-rheinsteel.com,"Hot-rolled and galvanized steel coils, plates and structural sections for European industrial buyers.",https://example-rheinsteel.com/logo.png,Steel coils|Steel plates|Structural beams,ISO 9001|EN 10025|CE,5 tons,4.7,180,https://example-rheinsteel.com
Casablanca Tube & Pipe Co.,Metal,Tubes & Pipes,Morocco,Casablanca,"Zone Industrielle Sidi Bernoussi",https://example-casatube.ma,+212 522 555 220,contact@example-casatube.ma,"Seamless and welded carbon steel pipe to ASTM and API standards.",,Seamless pipe|Welded pipe|Pipe fittings,API 5L|ASTM A106|ISO 9001,2 tons,4.5,96,https://example-casatube.ma
Dammam Electric Industries,Electrotechnical & Cabling,Cables & Electrical,Saudi Arabia,Dammam,"2nd Industrial City, Dammam",https://example-dammamelectric.sa,+966 13 555 7788,info@example-dammamelectric.sa,"Low and medium voltage XLPE power cables for industrial and building installations.",,Power cables|Control cables|Bare conductors,IEC 60502|ISO 9001|RoHS,500 meters,4.4,64,https://example-dammamelectric.sa
OnlinePack Kartons,Plastics & Packaging,Packaging,Germany,Pulheim,"Industriestrasse 8, 50259 Pulheim",https://example-onlinepack.de,+49 2238 555 33,verkauf@example-onlinepack.de,"FSC-certified corrugated shipping boxes with custom flexo printing.",,Corrugated boxes|Mailer boxes|Protective inserts,FSC|ISO 9001,1000 pcs,4.6,142,https://example-onlinepack.de
Gulf Construction Materials,Construction & BTP,Construction,United Arab Emirates,Dubai,"Jebel Ali Industrial Area 1",https://example-gulfcm.ae,+971 4 555 9900,sales@example-gulfcm.ae,"Bulk and bagged Portland cement and aggregates for GCC construction projects.",,Portland cement|Aggregates|Ready-mix,EN 197-1|ISO 9001,25 tons,4.3,51,https://example-gulfcm.ae
Invalid Row No Name,Metal,Steel & Metals,France,Lyon,,not-a-real-url,,,,,,,,,,
